koronavirüs etkisiyle nisan ayında ülkemize gelen yabancı ziyaretçi sayısı azaldı tüik in turist başına ortalama harcama verisi dikkate alındığında bu düşüş turizm gelirlerinde sadece nisan ayında yaklaşık milyar dolarlık bir gerilemeye işaret ediyor ;,0
ispanya ya temmuz da gelen turist sayısı yüzde düştü  ;,0
covid salgını sebebi ile mart tan bu yana uçuşlara ara veren onur air esnetilen seyahat kısıtlamaları neticesinde haziran itibariyle tekrar seferlerine başlıyor  ;,0
türkiye yine liste dışı   dalganin daha birincisi bitmedi bunlar ikinciden bahsediyor rahmetli kemal sunal in dediği gibi ağam benle dalga geçir;,1
 corona listemiz turizm moduna girmiş gibiye benziyor ey avrupa bize inanın ;,1
 italya nın venedik şehri kapılarını yeniden turistlere açtı ;,1
havalimanı nda giresun turizminden eser yok  ;,0
travelshop turkey genel müdürü murtaza kalender uluslararası ekoturizm topluluğu ties in türkiye tek yetkili elçisi olarak seçildi ;,1
 temmuz istanbul fatih eminönü pazartesi türkiye oteller çok çok güzel bir aile oteli personellerin güler yüzlü ve yardımseverligi ve yepyeni odaları ile aynı evimde gibi hissettim tekrar geleceğim herkese tavsiye ederim telefon ;,0
bursa da kültür ve turizmde güç birliği  ;,0
amasya valimiz sayın mustafa masatlı nın başkanlığında amasya ili ekonomik toplantısını gerçekleştirdik toplantıda ilimizin tarım turizm ve sanayi sektöründe faaliyet gösteren işletmelerin sorunlarına ilişkin görüş alışverişinde bulunduk ;,0
 uzun yıllar tarihi dokusunu korumuş olan ceyhan köprüsü taş köprü çevresine yapmayı planladığımız kılavuzlu millet bahçesini istemiyoruz ;,1
kars ın önemli tarihi binalarından olan beylerbeyi sarayı nın turizme kazandırılması için çalışılıyor;,1
turizm düşmanları iş başında liraya döner satmışlar ;,0
 dünyanın incisi marmaris  ;,1
yükseköğretim kurumları sınavı nedeniyle cumartesi günü saat ve pazar günü saatleri arasında uygulanacak sokağa çıkma yasağı müze ve ören yerlerini kapsamayacak ;,1
konyaaltı sahili tıklım tıklım  ;,1
vangölü güneyi dağları doğa turizmine yönelik çok farklı alternatifler sunuyor demedi demeyin  ;,1
okullar ağustosta açılamayacak kadar durum ciddi ise tatil kredileri turizm teşvikleri denizlere eğlencelere düğünlere nasıl ve neden müsaade ettiniz ;,0
beyoğlu talimhane sahne de gerçekleştirilecek kültür ve sanat etkinlikleri bölgeyi çekim merkezi haline getirecek;,1
izmir i bir de bu şekilde gezin izmir gezilecek yerler nereler izmir sokak görüntüleri mutlaka izleyin ;,1
turizm işçileri yunanistan da ayaklanmış turizm bu sene kayıp ;,0
 çeyrekte yabancı turist ülkemizde kişi başı dolar harcadı;,0
irlandalı yazar oscar wilde ın dediği gibi seyahat insanın ruhunu asilleştirir ve önyargılarını yok eder   ;,1
ve bugün günlerden kaş  ;,1
hollandalı turizmcilerden hükümete tepki türkiye en az italya ve ispanya kadar güvenli bir tatil ülkesi  ;,0
koronavirüs sonrası maceraseverler artacak tertemiz havasıyla dogasıyla binbir rengi ile yedigöller gidilmek için en uygun yerlerden bir tanesi ;,1
festivaller de yalan oldu ;,1
dünyanın tek yeraltı kervansarayı aksaray  burası ;,1
yandaş bir girişimci işadamı yıldızlı oteli için temel atma işlemlerine başlamış ;,0
diyarbakır surları turizme kazandırılacak ;,1
rumkale ye cam teras yapılacak ;,0
unesco dünya mirası listesindeki nemrut dağı turizme açılıyor;,1
avrupalı seçkin destinasyonlar projesi eden kapsamında mükemmeliyet ödülü alan bin rakımlı nemrut krater gölü kısıtlamaların kaldırılmasının ardından doyumsuz manzarasıyla doğaseverlerin en çok ziyaret ettiği yerlerden biri oldu ;,1
türkiye den ekoturizm alanı bir yanınız eşi olmayan habitat bir yanınız antik kent nefes aldıran rota seçtik ;,1
geliri azalan çalışan çareyi gayri resmi çalışmakta bulunca kayıt dışılık arttı ;,0
oksijen deposu kozak yaylası ndaki demircidere turizme hazırlanıyor ;,0
katar havayolları istanbul seferlerine başlıyor  ;,0
 döviz ve altın alımına vergi koyup valör getiren işsizlik sayısı artan covid yüzünden tabii ki ;,0
neymiş yıllardır turizm de tek gelir kaynağı olarak yurtdışını görüp yurtiçi turizmde bir aksiyon almazsanız tüm otel sahipleri başta olmak üzere tüm türkiye havaya bakıp uçakların üzerindeki havayolu şirketini okumaya çalışır  ;,0
 orman yangın larında ilkmüdahale   düşürdük dedi te ise   düşürmeyi hedeflemekteyiz ;,0
bakan ersoy bu yeni dönemde sevdiklerinizin mutluluğundan keyfinizden ödün vermeden tatilinizi gönlünüzce yaşayın diye sizin için her türlü detayı düşündük  v;,0
güney kıbrıs ta turizm sezonunu beklentileri karşılamadı  ;,0
yeni tur operatörleri ile mixx travel gücüne güç kattı;,0
şaka gibi ülkeyiz vesselam;,1
fırat nehrinin bir kolu olan ve selçuklu mirası köprüsüyle muş un önemli bir simgesi olan murat nehrinin turizme kazandırılması için çalışmalar hızla devam ediyor  ;,1
aslına uygun yapılan tüm restorasyon çalışmaları gururla izliyorum sayın ı tebrik ediyorum önemli olan tarihi eserlerimizi aslına uygun koruyup kollamak bugün bize emanet olan kültür mirasımız yarın çocuklarımıza emanet olacak ;,1
 izmir doğal yaşam parkı sayısı artıyor;,0
ünlü isimlere sesleniş marmaris muğla bodrum çeşme izmir yahu arkadaşlar antalya da çook güzel nerede bu ünlüler  ;,1
 koronavirüs nedeniyle turizm sektörü sıkıntılı günler geçirse de yavaş yavaş normalleşme adımları atılmaya başlanıyor;,0
 avustralya basını türkiye dev bir lüks gemi mezarlığına döndü;,1
bu gördüğünüz türkiye nin tanıtım broşürü artık memlekete turist yağar herhalde bunu hazırlayanın da onay verenin de ellerine sağlık ;,0
alman turizm acentalarının sahip ve yöneticilerini ağırlayan egeli turizmciler alman hükümetinin türkiye ye yönelik seyahat uyarılarına son vereceği umudunu koruyor ;,0
 düzce nin ve anadolu nun denize açılan en önemli kapılarından olan akçakoca sahilleri güneşli hafta sonunu denizde geçirmek isteyen tatilcilerin akınına uğradı  ;,0
 bakan ersoy ikinci dalgadan bahsediliyor bana göre bunun ikinci dalgası ekonomi  ;,0
kapalıçarşı restore ediliyor ;,1
sevdamız nevşehir imize yerli ve yabancı konuklarımızı bekliyoruz ;,1
şuro başkanı çoban turizm için uyardı  ;,0
turizm bakanlığı seyahat acentalarına yardımcı olabilmek amacıyla yılına ait seyahat acentaları aidatının alınmayacağını duyurdu ;,0
avrupa da turizmi kurtarma adımı karantina uygulanmayacak avrupa ülkeleri turizm sezonunu kurtarmak için seyahat koridorları kurmaya hazırlanıyor;,0
sivil havacılık genel müdürlüğü özbekistan uçuşlarının karşılıklı mutabakat sonucunda bugün başladığını duyurdu;,0
  turizmcinin odenegi dek uzatilmali heryil magduriyet yaşayan turizmci cevabini oy sandiginda veriyor antalya ve ilcelerden oy almak cok zor turizmi kalkindiran calisana gereken deger verilene  ;,0
 sektöründen türkiye bu yıl da yurt dışı tatilinde lider ülke olacak açıklaması ;,0
koronavirüs krizi nedeniyle turizm ve deniz trafiği gelirleri kesilen yunanistan ın ekonomisinde tarihi bir çöküş yaşanıyor ülke ekonomisi son çeyrekte yüzde küçüldü  ;,0
alanya da sosyal mesafeli maskesiz deniz keyfi ;,1
 turizm fransa nın güneybatısında yer alan padirac uçurumu nefis bir doğal güzelliğe sahip mağara kalkerlerinin arasında yer alan su birikintisi üzerinde bir rehber eşliğinde mağaranın derinliklerine kayıkla açılmak da mümkün ;,1
 miletos tiyatrosu kişilik kapasitesi ile ziyaretçilerini büyülüyor iyi korunarak günümüze kadar az hasarlar ile ulaşması bizler için şans  ;,1
 ve acentelerinin yeni destinasyonu istanbul ;,0
karayolu yolcu taşımacılığında yolcuya sıcak servis yapılamayacak  ;,0
 ekonomisi turizme bağlı olan antalya da iş dünyası kentin ekonomik afet bölgesi ilan edilmesini istiyor ;,0
 rus tur operatörleri ve acentalar istanbul marmara kapadokya nın ardından şimdi de mezopotamya turlarına başlama hazırlığında ;,0
kemençe eşliğinde piknik sezonu başladı ;,1
almanya nın kovid dan dolayı türkiye ye yönelik uyguladığı seyahat uyarısını aydın antalya izmir ve muğla için kaldırması turizmcileri sevindirdi   ;,0
bayramın günü kumbahçe öğle saatleri sahilde turistler yerine masa ve sandalyeler var güzelim ilçeyi bu hale getirdiler ;,1
antalya belediye turizm insanlar değerli olmayı unuttular önemli olmaya çalışıyorlar ;,0
sinema sektörü bir kez daha ankara da buluşuyor nın ;,1
 ülkemdeki birinci öncelikler turizmi canlandirmak ıraklılara iranlılara suriyelilere ev satışlarını artırmak yüzbinlerce hemde eğitim boşver o tehlikeli kapat gitsin;,0
turizm bölgelerindeki vakalarda artış var mı bakan koca dan o soruya yanıt  ;,0
üyelerimiz ile oturumda buluşuyoruz yarin da pandemi sürecinde turizmi ve acentalarimizin ihtiyaclarini konuşuyoruz ı ;,0
 turizm başkenti antalya alanya dolar euro yükselişinin girdi maliyetlerini arttiracaginin farkında kötü geçen bir sezonun hasar tespiti daha yapılmadı  ;,0
 avustralya basını türkiye dev bir lüks gemi mezarlığına döndü ;,1
dünya seyahat ve turizm konseyi nin yeni araştırmasına göre global seyahatin önündeki engeller uzun süre devam ederse sektörde milyondan fazla çalışan işini kaybedebilir ;,0
yabancı uyruklu yatlar kargo gemisiyle geliyor  ;,0
covid süreciyle turizm de görmezden gelemeyeceğimiz konular seyahat ve turizmin bundan sonraki süreçte hak ve sorumluluklar çizgisinde etik hukuk yönetim ve buna bağlı olarak da ekonomik analizlerle çok daha doğru düzlemlerde tartışılacağı anlaşılıyor ;,0
bayburt un kuzeyinde uzanan soğanlı dağları nda bin rakımlı soğanlı dumlu kavlatan ve günbuldu yaylaları doğal güzellikleri ve zengin bitki çeşitliliğiyle alternatif turizme ilgi duyan meraklılarını bekliyor   ;,1
turist sayısı yüzde azaldı;,0
balonlar urfa semalarında ;,1
bakan yardımcısı alpaslan dan turizm normalleşmesi açıklaması ;,0
giresun kalesi turizme hazır hale getiriliyor   ;,1
alman hükümeti milyar eura ile lufthansayı kurtardı;,0
 bu perşembe turizm sezonunun kaderini belirleyecek görüşme öncesinde almanya  ;,0
özlediğimiz günlere kavuştuk   ;,1
açık büfeye yok tabakta servis var ;,1
ekonomik sosyal ve kültürel değerler açısından bugün baktığımızda şehrimiz sahip olduğu tarihi geçmişi ve doğa güzellikleri ile doğru orantılı bir noktada değildir;,1
  turizm gelecektir seyahat acentasız turizm düşünülemez    ;,0
türkiye çin yeni paradigmalar çalıştayı istanbul da  ;,1
turizm güncel aza kanaat etmeyen çoğu hiç bulamaz haftanız sağlıklı ve güzel olsun;,0
pegasus haziran da uçuşlara başlayacak  ;,0
bugün eylül yi ve kırsal kalkınma yılı olarak belirledi yine yeniden edebileceğimiz günlere en kısa zamanda kavuşmak dileğiyle ;,0
bodrum kalesi nin ikinci etabı ziyarete açıldı  ;,1
mersin plajlarında mavi bayrak dalgalanıyor  ;,1
 ziyaret kapsamında gümrük kapıları ve bölgenin pandemi sürecinde geçirdiği zorluklara ilişkin çözüm odaklı görüş alışverişinde bulunuldu ;,0
 türkiye yabancı turist girişi yıllık temmuz ayı verileri açıklandı ;,0
antalya da beach park partisi ve kovid mücadelesi muratövünç dalga dalga derken dalgadan mı bahsediyor acaba;,1
 sektörünün birbirine en çok ihtiyacı olduğu bu zamanda seyahat kısıtlamalarının kalktığı turizm işveren ve işçilerimizin emeklerinin karşılığını aldığı iyi günleri yaşamak dileğiyle günü kutlu olsun   ;,0
seyahatlerinizi profesyonel turist rehberleri ile daha da anlamlı hale getirirsiniz ;,1
salda gölü ziyarete açıldı;,1
onur air haftanın günü bodrum a uçacak  ;,1
turizm kenti antalya da son gündür etkili olan ve dereceyi bulan hava sıcaklığı vatandaşları bunalttı ;,0
 milyon kişi ekolojik turizm alanında en iyileri seçiyor ;,0
tekirdağ ziyaretçilerine deniz kum ve güneş üçgeninin hakim olduğu alışılmış turizmin dışında bozulmamış doğası ve tesisleriyle temiz bir çevrede doğayla iç içe tatil imkanı sunuyor ;,1
 antalya ya azda olsa  günde bin turist geldi ;,0
dünyanın turistleri bodrum da karikatürize oluyor ;,1
büyük nuri camii saat kilisesi ve irak musul daki tahrain kilisesi birleşik arap emirlikleri tarafından insan mirasının korunması için tarihi kanıtlar ;,1
 ankara uluslararası film festival kültür ve turizm bakanlığının desteğiyle gerçekleştirilecek ;,1
marmaris belediyesi marmaris ticaret odası ve yda dalaman havalimanı ile jet arasındaki görüşmeler sonucunda kasım tarihleri arasında ingiltere iskoçya ve kuzey irlanda dan uçuş planlandı  ;,0
 maral dünya da eşi benzeri olmayan bir yapı odalı dubleks tripleks yapıya sahip amfi tiyatro ve doğal akustik ses özelliği ile eşsiz ve mükemmel bir baş yapıt hasan bey yüreğinize sağlık  ;,1
 ilya umanskiy sonbaharda ülke içi destinasyonlara yönelik talepte geçen yıla göre rekor seviyede bir artış bekliyoruz ;,0
rus turistlerin kararı değişti bu yıl türkiye de tatil yapacaklar;,0
türk hava yolları ve hava iş sendikası arasında ücretlerle ilgili yapılan görüşmeler sona erdi ve taraflar bugün anlaşmayı imzaladılar ;,0
dünyanın en güzel yerlerini ve biricik mirasımız türkiye nin doğal hazinelerini birlikte keşfetmeye devam ediyoruz  ;,1
yolculuk başlasın o zaman ;,1
sümela ya ziyaretçi akını truzimciyi güldürdü;,1
turizm  gelirlerinde iki basamak yükseldi dünya turizm örgütü yılı verilerine göre türkiye dünyanın en çok ziyaretçi ağırlayan ncı ülkesi oldu turizm gelirlerinde ise iki basamak daha yükselerek üncü sıraya yerleşti;,0
bulgar turizmine koronavirüs darbesi;,1
ankara nın tarih kültür ve turizm şehri beypazarı yeni normalleşme süreciyle birlikte ziyaretçilerini ağırlamaya başladı ;,1
bodrum un kayıkları denizde güzel karada ayrı bir güzeldir ;,1
şehir içi taşımacılığında uygulanmayan kurallar turist taşımacılığında neden uygulanıyor ;,0
ferah ve konfor hissi yüksek odalarımızda eşsiz bir deneyim yaşamak için davetlisiniz i ;,1
ağustos ta tüm kapılar açılıyor ;,1
konaklama sektöründeki işçi dolaşımı sorunu isg eğitim sertifikası ile giderilebilir mi  ;,0
çeşme de işletme daha mühürlendi  ;,1
paralela turizm acentası girit ve rodos adasına temmuz dan itibaren charter uçuşları başlatacağını duyurdu;,0
bu memleketin dağlarını bahar aylarında lalelerimiz süsler  ;,1
pegasus airlines bugün haziran arasında yapacağı yurtiçi uçuşlarını duyurdu açıklamaya göre havayolu hatta uçuşlarını başlatıyor ;,0
 bekliyoruz serik  belediye başkanına rüşveti kimin verdiği ile ilgili turizm bakanının açıklamasını ;,0
bahaş holding ceo su abdüssamet bahadır arka arkaya gelen konut kampanyalarıyla hareketlenen konut piyasasını değerlendirdi ;,0
şamran kanalında tarihe yolculuk başlıyor   ;,1
yerli tatil sezonunu bugün resmen açıyor işte ortalama fiyatlar ;,0
 ülkede yaklaşık tesisi olan otel grubu wyndham iki yeni otel daha açıyor  ;,0
izin yolu çile dolu  yıldık valla;,1
nevşehir de teki kentsel dönüşüm çalışmaları sırasında tesadüfen ortaya çıkarılan kayadan oyma tarihi kayaşehir in turizme açılması dolayısıyla bakan ersoy un da katılımıyla tören düzenlendi   ;,0
hükümet kiliseleri tanıtım atağına geçti kilise ;,1
 turizm için eğitimi feda etmişler sen daha ne dersin neyden bahsedersin ;,0
 turizm çalışanlarının yüzde i işsiz kalacak  ;,0
türk hava yolları genel müdürü bilal ekşi thy nin haziran tarihinden itibaren istanbul dan yapacağı yurtiçi uçuşların programını duyurdu ;,0
 yeni otel projesi yatırım teşviği kapsamına alındı ;,0
bu sekilde ic ice oturmalar serbest de dugunlere neden kisitlama geliyor aklim almiyor  ;,1
 kıskanılan ülke türkiye yi yıldır istediği gibi yöneten iktidar ekonomik sıkıntıyı döviz darboğazını aşmak için alman turist peşine düştük diyemiyor  ;,0
turizm dijital bilişim teknoloji boyutlu dijital şehirleri turizme kazandırmak asıl hedefimiz;,0
covid la beraber turizm kaldığı yerden tüm hızıyla devam ediyor ;,1
 türkiye nin güvenli turizm programı hollanda turizm basınında  ;,0
merhaba yaz bitti diyenler burada mı bizde kapalı ve ısıtmalı havuzlu villa seçeneklerimiz ile buradayız haydi yaza güzel bir vedayı herkes hakeder seni yüzlerce villa seçeneği ile bekliyoruz ;,0
antalya ya eylülde gelen turist sayısı milyonu aştı ;,0
  gastronomi turizminin ucundan tutmuş gelecek adına umut var geçerken bu girişimcilere uğramadan geçmeyin ;,0
denizli milliyetçiliği en zoru bencil olmak yerine hepimiz olsaydık siyaset de başkanlar bizden çıkardı ticaret de marka şehri olurduk turizm de eyfel kulesine değil laodikya ya akın ederdik aşk çeşmesine değil kleopatra antik havuzuna sığamazdık  ;,0
turizm için uygun faizli kredi açıklandı şezlong fiyatları bile uçtu konut için kampanya yapıldı anında fiyatlar uçtu otomotiv için kredi kampanyası başladı aynı gün en düşük modellerine zam yaptılar anlamadığım bu ülkede para kazanan herkes halka neden bu kadar düşman;,0
sultan orhan gazi yadig rı kocaeli şehrimizin osmanlı dönemi eserleri ni konuşacağız ;,1
zeugma müzesi nde eserin kayıp olduğu ortaya çıktı  ;,1
zorunlu hale getirildi yabancı turist için geçerli değil ;,0
  ersoy medeniyetimiz asırlar boyu tüm dünyada mazlumların umudu ve sığınağı olmuştur ;,1
turizm istatistikleri yayımlanmayacak tüik covid nedeniyle aksayan çalışmalardan dolayı ikinci çeyreğe ilişkin turizm istatistiklerini yayımlamayacağını duyurdu  ;,0
 xinjiang uygur özerk bölgesi turizm sektörünü canlandırmak için çeşitli uygulamaları hayata geçirdi farklı turizm etkinlik arasında kaşgar ipekyolu kültürü kavak festivali sayram gölü etrafında kara yolu bisiklet yarışı bulunuyor ;,0
kültür ve turizm bakanlığı türkiye de tatilin güvenli olduğu mesajını veren ve ziyaretçilerin tatillerinde türkiye de doğa ve tarihi bir arada tecrübe edebileceğini anlatan bir video hazırladı;,1
otobüsler daha sağlıklı çifte standart uygulayan yetkilileri kınıyoruz bu kadarda tarafinizi belli etmeyin ya kardesim c ;,0
 keşke bize turizm sizden önemlidir diye açıklama yapsanız en azından dürüst olursunuz ;,0
üç bin yıllık kent birgi turizmde hak ettiği değeri almak istiyor çok sayıda medeniyete ev sahipliği yapan izmir in ödemiş ilçesindeki tarihi mahallesi birgi efeler yolu projesi sayesinde daha çok ziyaretçiyi ağırlayacak;,1
bu korona herhalde sadece okullara ugruyor plajlara parklara avmlere sokaklara kaldirimlara piknik alanlarina korona girmiyor herhalde;,1
stratonikeia kültür varlıklarımızı turizmin hizmetine sunmaya hazırlanıyor    ;,1
 yaz turizm sezonunda yüzde iş yaptik ;,0
yunanistan dan hızlı turizm hamlesi yunanistan haziran dan itibaren ülkeden turist kabul edeceğini açıkladı liste temmuzda yenilenecekmiş açıklanan ülkeler arasında ise komşu türkiye yer almıyor neden ;,0
mardin nusaybin beyazsu bagok dağı nda kemençe rıbab eşliğinde piknik  ;,1
üç bin yıllık kent birgi turizmde hak ettiği değeri almak istiyorçok sayıda medeniyete ev sahipliği yapan izmir in ödemiş ilçesindeki tarihi mahallesi birgi efeler yolu projesi sayesinde daha çok ziyaretçiyi ağırlayacak ;,1
tui grubu bugün yaptığı açıklamayla amerikalı uçak üreticisi boeing ile max modelinin uçuş yasağı nedeniyle uğradığı zararın tazmini konusunda anlaştıklarını duyurdu  ;,0
muğla nın marmaris ilçesine gitmedim demeyin  ;,1
mini istihdam paketiyle kısa çalışmadan normale dönen işverenlere prim desteği geliyor ;,0
adana da gezilecek en güzel yerler ;,1
hangi ülkelere yurt dışı uçuşlar yapılacak  ;,0
kaymaklı marzuba mahallemizde gündönümü turizm ck güven mansion açılışını gerçekleştirdik nostaljik aracıyla ve tarihi evleriyle muhteşem bir doğa araklı   ;,1
türkiye yine liste dışı;,1
arkadaşlar türkiye nin turizm alanında gezilip görülmesi gereken yer üstü tarihi yerler ve yer altı mağaralar şeklinde a dan z ye profesyonelce hazırlanmış akordiyon şeklinde katlanabilen çantada taşınabilecek satın alabileceğimiz bir haritası mevcut mu turizm türkiye;,1
  ersoy turizm trafiğinin başlamasıyla birlikte marka oteller dahil bir çok otelin hızla açılmaya başladığını söyledi  ;,0
 turkey kültür ve turizm bakan yardımcımız sn tr ramazan da yaklaşık ülkeye türkiye nin yardımlarını ulaştı ;,0
bölge temsil kurulu toplantısı projelerin planlandığı yoğun gündemle gerçekleşti;,0
türkiye turizm diplomasisinde başarılı olabilecek mi ;,0
şehr i aziz el aziz in kalbi anadolu nun ilk yurtlarından harput misafirlerini bekliyor ;,1
atina  bakanlığı ülkenin vatandaşına turizm faaliyetleri kapsamında ülkeye giriş izni verileceğini açıkladı ;,0
kültür ve turizm bakanlığı türkiye nin normalleşme sürecinde sunacağı turizm hizmetini yeniden keşfet tanıtım etkinliğiyle dünyaya göstermeye hazırlanıyor ;,0
burası tarihin sıfır noktası göbeklitepe ;,1
 rus tur operatörleri ve acentalar istanbul marmara kapadokya nın ardından şimdi de mezopotamya turlarına başlama hazırlığında ;,0
kültür ve turizm bakanlığınca kontrollü normalleşme sürecinde kültür ve sanat tesislerinde alınması gereken önlemler belirlendi   ;,1
easyjet dün yaptığı basın açıklamasında covid krizi nedeniyle düşen talep neticesinde maliyet önlemi olarak mevcut filosunda ve işgücünde tasarrufa gideceğini duyurdu ;,0
metro dan şefleri onurlandıran reklam türk mutfağina doyulur mu  ;,1
travel travel turizm diye tutturuyordunuz noldii değdu mi bariiturizm ;,0
dedeman türkiye nin güzelliklerini keşfetmeye davet ediyor ;,1
ingiltere türkiye arası turizm koridoru açılacak  ;,0
rusya dan turizmciyi sevindiren haber ;,0
antalya rehberler odasının farkındalık yaratan çalışması hakan aysev beye de katkılarından dolayı teşekkürler  ;,1
 zumi için bu süreç bir şans doğa öko ve slow turizm gibi ;,1
sahillerinde sosyal mesafeli deniz ve güneş keyfi dönemi ;,1
antalya ya bin rus turist geldi bu yıl turizm de patlama yaşanacak  ;,0
fransa turizm geliri nin ilk yarısında milyar milyon azalmış covid nedeniyle yabancı turist gelmediği için zarardalar;,0
türkiye güvenli turizm için hangi adımları attı  ;,0
kaleiçi yat limanı eski günlerine dönmeyi bekliyor  ;,1
salıpazarı nın doğal güzellikleri turizme kazandırılıyor ;,1
huzurlu ve keyifli bir haftasonu diliyorum bu arada yeni öğrendim meğer telmessos tiyatrosunun yanında bir yanı oyulmuş kayaya yaslanmış apollon tapınağı varmış  ;,1
turizm ve turizm profesyonelleri bundan iyi anlatılamazdı ;,0
adnan menderes adası gerekli düzenlemeler yapılıp kötü görüntüden uzaklaştırılmalı adana halkının daha işlevli kullanabileceği bir alana dönüştürülmeli  ;,1
lalenin anavatanı neresi cevabı  ;,1
murat saraçoğlu bursa turizmde yeni rotasını çizdi  ;,0
 antalya yı neden saklıyorsunuz  ;,1
kars aniharabeleri  bisiklet turu çok güzel bir gezi oldu;,1
turizm sektörünün kaderi yeni vakalarda  ;,0
alanya turizminde rusya sevinci  ;,0
 özel sektörün kamp yeri yapma girişimi teşvik kapsamına alınmalı   ;,0
dünya genelinde turizm ve seyahat sektöründe milyon insan istihdam edilir ve bu sektörün küresel gsyih ya yüzde luk katkısı vardır bu sektörün pandemiden sonra nasıl bir yol izleyeceği bütün dünyada merak konusu;,0
türkiye de butik oteller resort lara karşı  ;,0
yıl turizm bakanlığı turistler için finlandiya dan tuvalet kağıtı ithal etti;,0
sosyal mesafeyi unutmanın bedeli ağır olmaz umarım ;,1
 kültürel doğal ve sosyo ekonomik canlılığıyla cennetin eşşiz limanı mersindeyiz ya siz ;,1
 haziran itibariyle kademeli olarak başlayacak yurt dışı uçuşlar satışa açıldı  ;,0
bm ülkeler arası seyahat bu yıl yüzde oranında düşebilir ;,0
urfa kalesinde kazı çalışmaları sürüyor  ;,1
milas uyku vadisi kanyonun ortasında gizli kalmış bir güzellik ;,1
bursa da turizm için en önemli faktör tarihi eserleri ancak bu yetmez bursa da eğlenceye yönelik yerler açılmalı ve buralar belirli bir bölgede olmalı alışveriş ve eğlencenin olduğu sembol cadde yapılmalı ve ses getirecek sembol bir eser yapılmalı  ;,1
antalya belediyeler kaş turizm vatandaşı engellemek nedir bunun hem yasal hem de etik olmadığını söyleyecek bir tane akıl irfan sahibi bulunmaz mı belediyede hangi vasıflara sahip olanlar yönetiyor belediye iletişim hesaplarını ve bir başkan bunları niye kontrol etmez ;,0
turizmciler iç sezon için hazırlıklarını ve öngörülerini açıkladı;,0
süleymanlı kültür köyü projesi hayata geçiyor    ;,1
antalya ayda milyon bin turistin adresi oldu turizmin başkenti antalya ya ayda ülkeden milyon bin turist geldi;,0
bu memlekette galata kulesine bile tecavüz edildi   ;,1
