turizmde akşehir in lokomotifi küçükağakonağı;,0
uluslararası turizm filmleri festivali kapadokya da başladı ;,1
akdeniz de şehir ve deniz turizmi lokasyonlarının tatil iklim endekslerini hci incelediğimiz makalemiz yayınlandı  ;,0
turizm devi silkar ın iflası istendi bir dönem türkiye nin en büyük otelcilerinden biri olan ın istendi ;,0
 etstur a da yazdım bu şikayetlerimi hem ets hemde voyage otelin verdiği hizmetten şikayetçiyim ;,0
 turizm fatih bey yurtdışından üst segment turist getirmekteydik önümüzdeki yıl nisan mayıs a kadar gelen giden yok kredi çekip önödemeleri geri ödedik şimdi aldığımız kredikeri kasımda nasıl öderiz ciroya bakarak hibe şart yoksa turizmden yakında döviz gelişi zor;,0
turizm bakanı mehmet ersoy dan önemli açıklamalar   ;,0
ahmet aras bodrum da oteller ve mekanlarda vakaya rastlanmadı;,1
bursa da iç turizmde tanıtım atağı  ;,0
izmir in turizm beldelerinde altyapı atağı ;,0
turizmde kayıp trilyon doları bulabilir ;,0
 avmlere sokaklara piknik alanlarina sahillere cikmak serbest ancak is egitime gelincemi korona var yasak var buna kargalar guler ;,1
 online seyahat pazarı hızla büyüyecek  ;,0
kaş kas turizm imar yolsuzluk bak şu allahın işine ;,0
kavakpınarı köyü güzelliği ile hayran bırakıyor    ;,1
trabzon da restorasyon nedeniyle ziyarete kapatılan sümela manastırı ayasofya camii ve kızlar manastırı kültür ve turizm bakanı ın katılımıyla temmuz ayının son haftasında ziyarete açılacağı yönünde haberler var hadi hayırlısı ;,1
 istihdamdan turizme kadar bütün alanlara dokunacağız ;,0
turizm sektörüne istihdam katkısı antalya için en öemli sorun;,0
havza da hamamlar açılmış daha yeni haberimiz oldu şuanda sadece modern türk hamamı açık hamamseverlere duyrulur ;,1
bütün ülke olarak antalya ya ümit bağladık düştüğümüz hale bak  ve ne olacağını da bilemiyoruz gelecek turistlerin covid mi diye;,1
tarihin huzur dolu mekanı film setlerine ev sahipliği yapmış tarihi taşhan alem i çarşı yy yolunuz düşerse bir çaya bekleriz;,1
anlamadığım diğer bı konu ise galatakulesi nerden çıktı amaç ne tarihimize sahip çıkmamız gerekmiyor mu ilgililere sorarım galatakulesinedokunma turizm ve turizmciler i öldürdünüz ölüyor son dönemlerde olup bitenleri hayretle şaşkınlıkla izliyoruz film gibi içim acıyor ;,1
tatilciler ve turizm sektörü almanya nın kararından memnun ;,0
turist rehberleri zor durumda acentalar taşımacılar da öyle aylarca ayakta durmanın imkanı yok devletin çözüm odaklı kurtarıcı planları eyleme geçirmesi şart ;,0
güvenli turizmin adresi  çeşme;,1
 dönümlük tarla turizm ve ticaret alanı oldu  ;,0
güvenli turizm sertifikasyon programı kapsamında zorunlu tabela  ;,0
kusursuz organizasyonlar için yeni normalde de yanınızdayız  ;,0
hareket arttı umutlar yeşerdi  ;,1
ekonomiye milyar liralık sıcak para ;,0
nusaybin beyazsu sizleri misafir etmeyi bekliyor ;,1
alanyali turizmciler hayal kirikliğina uğrayacak ;,0
 yıl önce kurulmuş osmanlı köylerinden selam gönderiyorum size sultan orhan gazi yadig rı kocaeli şehrimizin eski köylerinin izini sürüyoruz  ;,1
mimar sinan ın yaptığı son hamam olan mimar sinan çarşısı nı sizlerle paylaşmıştık alınan bir karar ile esnaf çarşıdan çıkarılmış umarız faydalı bir hale getirilir ;,1
saruhanlı daki doğa harikası göl turizme açılacak  ;,1
kapadokya konuşmaları nda kapadokya nın kalkındırılmasında turizmin rolü rektörümüz prof dr hasan ali karasar ın moderatörlüğündeki canlı yayınımız haziran salı günü  ;,1
 aynı şehir iki farklı belediye aralarında metreler var lakin sanat ve estetik anlayışları arasında uçurum beton dökme ve ben yaptım oldu anlayışıyla sanat olmaz anlamıyorsanız yapmayın ya da iki metre ötenizde hazır yapılmışından ibret alın  ;,1
pandemi sonrası turizm tesisleri iç düzenlemede hangi değişiklikleri yapmalı;,0
 etstur sadece bar da çalışan arkadaşlar iyiydi eğer çocukla gidecekseniz denize kıyıdan giriş yok çocuklar da mı iskeleden atlasın yani ;,1
 turizm canlansin diye her turlu kolayligi sagliyorsun bizleri de düşünün ;,0
her otel alanı bir gün yanacaktır ne bir santim eksik ne bir santim fazla ;,0
hac ve umre ziyaretlerinde milyonlarca insana hizmet vermiş yıldır da hizmet veren acentalara diyanet ve bakanlık sahip çıkmalı küçük acentalar yok olsun büyükler var olsun politikası kazandırmaz kaybettirir  ;,0
her yıl istanbul da yapılan doğu akdeniz uluslararası turizm ve seyahat fuarı istanbul yılında yapılmayacak ;,0
dünyanın en ilginç kayası çin in güneybatısındaki chongqing de bulunan ince bir sütunun üstündeki bu mega kaya bölgeyi popüler bir turistikmekan haline getirdi ;,1
para değil mi ekonomi ucuyor diyenler hani nerdesiniz;,0
ine yeni standart işletmeler turuncu çember içinde ;,0
 yıl önce bodrum güvercinlik te yanan bu arazi için dönemin yetkili bakanı sayın veysel eroğlu bir çivi bile çakılmayacak ormanlaştıracağız demişti ağaçların şekli otel ve havuz gibi yeşilin rengi de bir başka sanki ;,0
antik kentleri eşsiz koyları yeşil ve mavinin en güzel tonlarını barındıran mersin turizm sezonunda yerli ve yabancı turistlere birçok seçenek sunuyor   ;,1
türkiye nin maldivleri ne ziyaretçi akini ;,1
eyfel kulesi yeniden açılıyor  ;,1
dünyanın tek yeraltı kervansarayı aksaray da burası ;,1
bu ülkede kültür sanat turizm ile giderse kültür olur şaklabanlık sanat olur şaklabanlık turizm olur misyonerlik reis vizyonuna sahip kadrolara sahip olamadı onun yakını bu hatırlı maalesef işi siyaset olmayıp işinde gücünde olanı da bezdirdi ;,1
 misis i dünyaya tanıtacağız ;,1
türkiye de yüzbinlerce turizm işçisinin milyonu aşan nüfusuyla zor günler geçiren tüm turizm emekçilerinin dünya turizm günü kutlu olsun  ;,0
sivas divriği ilçesinde uygulanacak cam seyir teras projesi ilçenin turizmini zirveye çıkaracak  ;,0
 türk turizmine kanat gerenler serisinin kitabı yayımlandı  ;,1
 gündemrusya nın ankara büyükelçisi yerhov türkiye nin turizmdeki kovid önlemlerini değerlendirdi  ;,0
hareketi seven kıpır kıpır insanlar yani festival tutkunları için tatil önerileri kaleme aldık hem yurt içi hem de yurt dışı alternatifler oldukça fazla festival ;,1
karadeniz huser rize yayla bulut denizi horon eşi benzeri olmayan güzellik;,1
tursab akdeniz baskani ferit turgut agustos ayinda verdigi röportajda bölgemizde turizm i değerlendirdi ;,0
doğa davet ediyorsa mutlaka görmelisin  ;,1
türkiye nin sağlık turizminde hedefi milyar dolar ;,0
antalya sokak köpeklerinin istilasına uğramış turizm felç  ;,0
bu yıl mavi bayraklı plaj sayıları antalya da ya muğla da e izmir de ye aydın da e balıkesir de e istanbul da ye samsun da da e yükseldi van ise denize kıyısı olmamasına rağmen mavi bayraklı plaja sahip olan tek il olarak kayda geçti;,0
define arama diye bir yönetme olur mu yahueee biz neden okuduk arkeoloji neden o kadar arkeolog var memlekette destek olun kazılara hem mesleğimizi yapalım gem ülke kazansın  ;,1
türkiye nin önemli turizm merkezlerinden çeşme deki delikli koy dalgaların aşındırdığı kayaları ve tertemiz deniziyle ilgi görüyor ;,1
bu sene kar senesi değil ar senesi dedi sevgili dostum barış tansever yeni normal için bizimle çok şey paylaştı bekleriz ;,1
simav ilçemize bağlı olan gölcük yaylası sahip olduğu doğal güzelliklerle sizleri bekliyor plateau nature tourism welcomesyou ;,1
antalya manavgat kısalar daki vakıf parselin ihalesini kazanan turizm yatırımları aş ile yapım karşılığı kiralama sözleşmesi bugün imzalandı hayırlı olsun  ;,0
kurugöl göletinde piknik yapın manzaranın tadını çıkarın ;,1
haftanın önemli gündem konuları turizme global bakış programında konuşuldu ;,0
turizm sektörü eski günlerini arıyor;,0
osmangazi fetih müzesi nde hasret bitiyor ;,1
avrupalı uçak üreticisi airbus covid krizi nedeniyle yazına kadar yaklaşık çalışanla yollarını ayıracak   ;,0
 almanya hükümeti nin turizm sorumlusu ndan türkiye açıklaması;,0
salgında küçülen seyahat acentaları desteği istiyor döneminde en fazla zarar gören sektörün olduğunu ifade eden acentalarının temsilcileri voa türkçe nin sorularını yanıtladı ;,0
güvenli turizm sertifikasyon programı açıklandı temel kriter belirlendi  ;,0
türkiye ye ayda milyon bin turist ;,0
çukurova nın güneydeki koruyucusu toprakkale kalesi her tarafı tarih kokan osmaniye yi keşfetmen için bir neden daha durma ;,1
birleşik krallık ın önemli havayolu ve tur operatörlerinden jet uçuş ve tatil operasyonlarına başlayacağı tarihi bir defa daha erteleyerek temmuz u işaret etti ;,0
antalya yüzbinlerce rus turisti günde ağırladı   ;,0
yok orayı yaktılar otel için yok burayı gitmeyin tatile bu zamanda bile tatile gidiyorsunuz çoluk çocuk tatil anlayışınız da berbat turizmin içine ettiniz  ;,0
ticaret bakanlığı milyonlarca kişiyi ilgilendirecek karar aldı  ;,0
rusya iç turizmi güçlendirme odaklı yıllık turizm planı hazırlıyor evinizde ne kadar işlevsel olursanız o kadar dinamik olursunuz  ;,0
alanyali turizmciyi umutlandiran haber ;,0
mehmet gülümser yazdı acente sahipleri de umutsuz  ;,0
tarihi ankara kalesi sokaklari hayat bulacak ;,1
iç turizm canlandı ama vaka sayısında beklenmedik artış  ;,0
orta anadolunun gobeklitepe si ilk yerleşik hayat ilk tarım ilk beyin ameliyatı burada yapıldı;,1
yorulmak yok allah güç kuvvet versin stratejik sektör turizm için gaziantep için türkiye için durmak yok yola devam   ;,0
hallstatt gölü almanya avusturya sınırında olan salzburg şehrinin km güneydoğusunda bulunur bu muhteşem göl doğal güzelliği ve görselliği ile unesco dünya mirası listesine alınmıştır dünyada en çok fotoğrafı çekilen yerden biridir ;,1
 assos ta midilli ye karşı şarabimi yudumladım ;,1
bilimkurulu turist getirmek icin herseyi yaptiniz yurtdisi turlar dahi yaptiniz otellerimiz koronaya hazir hijenik tedbirlerimizi aldik bu ulkenin egitimi icinde boyle gayretli olun zahmet olmazsa ;,0
tüketicinin korunmasının güçlendirilmesi projesi kapsamında düzenlenen covid ve turizm ulaştırma sektörlerinde tüketicinin korunması konulu çalıştay eylül tarihinde ankara da başladı ;,0
antalya da oteller müşteri almaya başladı ama bir şartları var  ;,0
turizm yerine geldi mi bari milyonlarca kişinin düzeni bozuldu turizm bakanı mutlu oldu mu artık ;,0
bir acayip yasak konyaaltı sahilinde yaş üstü yabancı turiste  serbest üstü yerli halka saat den sonra yasak     ;,1
kentin ilk yerleşim yerlerinden yıldırım da doğanın yanında tarihi bölgeler de gezilebilecek yerler arasında bulunuyor  ;,1
urfa erkeği milattan önce neyse milattan sonra da odur uzanıp ense yapmak ruhumuzda var ;,1
ankara da mutlaka görülmesi gereken tarihi mekanlar ve müzeler ankara başkent gezmek görülmesi gereken nyerler  ;,1
helmut kohl ün müsteşarlığını yapan ve hristiyan demokrat parti üyesi olan gazeteci friedhelm ost türkiye izlenimlerini övgü dolu cümlelerle paylaştı      ;,1
bu ayki gazetesindeki yazım umarım bu günleri hep birlikte turizm  aşarız ;,1
ahmet aras turistler için arkadaşlarımızla en iyi hizmeti vermeye devam edeceğiz ;,0
başkan bahar turizme maksimum katkı sunmayı hedefliyoruz ;,0
alman seyahat şirketlerinde ciro hız kesti;,0
 perşembe günleri nostaljik paylaşımlarımız devam ediyor ;,1
türkiye ve dünya turizmi hakkında kilit bilgiler içeren güzel bir yazı olmuş ;,1
 önümüzdeki sene ayakta kalabilmemiz için sezonunda yılı için geçerli olan kdv indirimi önümüzdeki senede devam etmelidir sgk prim destekleri arttırılmalıdır tga nın alacağı konaklama vergisi yıl daha ertelenmelidir ;,0
sürmene  memiş ağa konağı ile ilgili yazımıza linkten ulaşabilirsiniz  ;,1
seyahat etmeyi keşfetmeyi seven ve turizme emek veren herkesin eylül dünya turizm günü kutlu olsun;,0
dome glamping için sapanca ya gelin ;,1
istanbul un simgelerinden galata kulesi ziyarete açıldıistanbul un simgelerinden biri olan galata kulesi video mapping ve ışık gösterisi eşliğinde gerçekleştirilen törenle ziyarete açıldı ;,1
dünyada en yüksek turizm gelirine sahip ülke rakamları milyar dolar abd  ;,0
 yaşındaki carnival imagination hurdaya çıkmak üzere     ;,1
turizm bakanimizin otel ve tur sirketi yeteri kadar kar ettise artik ruslari testsiz almayi biraksak mi acaba ;,0
salda nın kıyısına şantiye kuruldu ;,0
vietnam da eskiden taksi şoförüyken köşeyi dönen bir mütahit yeni oteli için ton altın kullandı tepedeki havuz ve odalardaki küvetler klozetler altın kaplamalı gecesi dolarmış vietnam da koronadan ölen yok vaka sayısı civarında   ;,1
  berber acikmi acik kafeler avmlerde insanlar oturup yeyip iciyormu evet tatil kutlamalar varmi var sehirlerarasi yolculuk varmi var eee o zaman derdiniz ogrencilerle koronayla degil ;,1
 sadece kentler turistik ve gelişmiş bölgeler için değil birçok kırsal topluluk için bir cankurtaran halatıdır turizm sadece üniversite ve turizm mezunlarını değil özellikle kadınlar ve gençler için önde gelen bir istihdam kaynağıdır müz kutlu olsun ;,0
türkiye de ikinci güvenli turizm belgesi alanya ya gitti ;,0
her yıl binlerce katılımcıyı ağırlayan uzakrota travel summit bu sene covid nedeniyle online olarak gerçekleşecek   ;,1
 pandemi havacılık sektörünü nasıl etkiledi hangi önlemler alındı ;,0
romanya da otellerde konaklayan yerli turist oranında yüzde yabancı turistlerin oranında yüzde düşüş yaşandı ;,0
turizm amaçlı kurulan tesis çürümeye terk edildi;,0
turizmde sert düşüş ;,0
turizm sezonu bitince sokağa çıkma yasağı mı geliyor   ;,0
geçen yıl hem yerli hem yabancı turist sayısı bakımında rekorlar kıran sektörü bu yıl pandemi nedeniyle zor bir dönemden geçiyor bayramhaberleri gazetehaberleri kurbanbayramı  ;,0
antalya belediye turizm hiçbir sanatsal bilgi ve birikimi olmayanların elinde bu şehre yazık oluyor ;,1
koronavirüs nedeniyle turizm sektörü sıkıntılı günler geçirse de yavaş yavaş normalleşme adımları atılmaya başlandı ;,0
kendi düşüncem başta turizm gıda parekende inşaat bankacılık sektörleri ön planda olacak gibi duruyor ;,0
s yeme içme konaklama ve diğer hizmetlerde kdv oran indirimi    ;,0
 eylül pazartesi gününden itibaren teknelerde yapılan düğün nikah sünnet düğünü kına gecesi nişan vb etkinlikler ile açık alanlarda yapılacak konser gösteri festival vb etkinlikler yasaklanıyor  ;,1
turizm cenneti adalarda kovid sessizliği;,1
istanbul nereye gidersen git geri döneceğin özleyeceğin yer burası ;,1
dünyanın en büyük online turizm etkinliği yolda ;,0
turizm ve turizmci ile zerre ilgisi olan dikkatle okusun lütfencilik hotel gıda sektör ulaşım siyaset yönetim çok önemli tespit ve uyarılar ;,0
sosyal mesafeyi unutmanın bedeli ağır olmaz umarım ;,1
koronavirüsten türkiye de en çok kapadokya etkilendi ;,1
gez ceylan bu dağlarda ;,1
türkiye otelciler birliği pandemi kısıtlamalarının gevşetilmeye başladığı haziran ayına ilişkin otel doluluklarını açıkladı   ;,0
sürdürülebilirlik ekolojik ekonomik ve toplumsal boyutları bir arada barındıran bütüncül bir bakış açısıyla hem bireylerin hem de toplumların en temel konularından biri olmaya devam edecektir  ;,0
gyo lar ve turizm hareketli olur mu bugün acaba ;,0
kültür ve turizm bakanlığı türkiye nin normalleşme sürecinde sunacağı turizm hizmetini yeniden keşfet tanıtım etkinliğiyle dünyaya göstermeye hazırlanıyor  ;,0
 bu yaz sen nerede olursan ol enerjin seninle  ;,1
göbeklitepe ye balon turu izni ;,1
 kurum yerli ve yabancı turistler için önemli bir turizm merkezi olan ilçemizin çehresini de değiştirecek;,0
bu plajlarda özgürce yüzün ;,1
kars susuz kiziroğlu köyüne muhteşem bir gezi  ;,1
 yıldızi değmesin ayağın taşa değmiyor hiç bir şey bunca uğraşaar edep bilmezle etme  ;,1
 izmit belediyesi eylül dünya turizm günü kapsamında tarih koridoru gezisi düzenleyerek izmitlileri kent tarih ile buluşturdu   ;,1
karataş ilçemizin doğal zenginlik ve kültürel miraslarını daha çok ön plana çıkarıp turizm potansiyelinin arttırmak için hizmet üretmeye devam ediyoruz  ;,0
deniz kuvvetleri komutanlığı tarafından bodrum deniz müzesi ne anlamlı bağış  ;,1
turizm çalışanlarına yıl sonuna kadar aylık tl yardım;,0
yunanistan dan muhteşem manzaralar ;,1
kovid tedbirlerine uymayan işletmenin daha faaliyetleri durduruldu;,0
lufthansa grubu bünyesindeki havayollarının eylül itibariyle toplam milyon müşteriye yaklaşık milyar euro tutarında iade yaptığını duyurdu;,0
rize nin pazar ilçesine bağlı yeşilköy de ulaştırma ve altyapı bakanlığı nca hektarlık alanda projelendirilen rize artvin havalimanın inşaatı hız kesmeden devam ediyor  ;,0
turizmde gizli müşteri dönemi başladı ;,0
tuz gölü nde flamingo mevsimi  bir harika dostum ;,1
dünya mevleviliğinin ikinci adresi olan afyonkarahisar da frigya vadileri arasında yer alan emre gölü buz tuttu buz tutan gölün üzerinde semazen bahadır okyar sema gösterisi yaptı çağrı selek in görüntülediği sema dikkat;,1
saat mekanların kapanması ile işten çıkarılmayı yasaklayıp dk da verilen kararla milyonlarca sektör çalışanlarını işsiz bıraktınız nedir bu sektörğn sizden çektiği yazık değil mi bunca çalışana ;,0
bu kitap topraklarında öne çıkan dini yapıları dini fenomenler ve efsaneleri önemli kişilerin izleri ve din mek nları bir araya getirme düşüncesiyle ortaya çıkmıştır ;,1
adana da unutulan tarih turizme kazandırılacak ;,1
türkiye nin eşsiz zenginlikteki tarihi ve kültürel varlıklarının sergilendiği den fazla müze ve ören yerine ziyaret olanağı sağlayan müzekart ın kapsamı genişliyor ;,1
biraz huzur yazılı kanyon gün batımı  ;,1
hong kong da turizm neredeyse durduhong kong un turizmi haziranda daha da kötüleşti ve ziyaretçi gelişleri yıllık lik bir düşüşle e geriledi  ;,0
denize düşen balığa sarılır ata demirer de sarıldı  ;,1
turizm sezonu bitti ve yasaklar geliyormuş eee deniz soğudu artık ;,0
 çocuklarımız turizm gelirine kurban edilemez ;,0
bakan ersoy un çeşme projesi teması  ;,1
tarihin sıfır noktası semalarında balonla yolculuk başlıyor hazır mısınız  ;,1
otobüs firmaları seferlere başlayacakları tarihi açıkladı;,0
berlin de turizmciler sokaklara indi ;,1
ağustos ayına ait hava yolu istatistiklerini açıkladı;,0
 yıllık tarihinin en kötü üç ayını geride bırakan ryanair nisan mayıs ve haziran aylarını kapsayan ikinci çeyrek için milyon euro zarar açıkladı ;,0
bodrum un eşsiz gün batımı manzaraları tatilcileri hayran bıraktı hemen her akşam gümüşlük yalıkavak ve turgutreisten bu manzarayı görebilirsiniz  ;,1
kaş patara temmuzda para bastı   ;,0
türk hava yolları haziran da bazı yurtdışı seferlerine yeniden başlayacak bu ülkelerden bir tanesi çin  ;,0
bi daha bodrum şöyle pahalı çeşme böyle pahalı demeyin mikonos ta bir kadeh prosecco ya yazmışlar ve yaygın bir olaymış  ;,1
 değerli yetkili arkadaşlar mesleğimizin kriz durumunda olduğunun farkındasınız değil mi bizlere açılışlar veya canlı yayın sohbetleri değilde turizm in temel taşları seyahatacentaları na kayda değer bir görüşmeler yapsanız biz çok zordayız farkında mısınız ;,0
 verilerinin yer aldığı dünya turizm örgütü unwto mayıs barometresi açıkladı ;,0
karacabey in yazlık tatil bölgeleri turizmin merkezi ;,0
ordu büyükşehir belediye başkanımız sn ile ilimizin yatırım projelerini görüştük özellikle bölgede doğal kaynaklarımızın su ulaşım tarım çevre turizm gibi faktörlerle bütünlük içinde değerlendirileceği bolaman havzası entegre projesini inceledik ;,0
iki ünlü blogger urfa nın tarihi bölgelerini gezdi ;,1
başkan böcek baraner ve ayık turizmi masaya yatırdı;,0
turizm sektöründe kriz büyüyor yardım olmadan ay dayanırız   ;,0
japonya başbakanı abe nin mirası olan turizm stratejisi birçok ülkeye ders niteliğinde japon mucizesi ;,0
 mehmet işler ege bölgesi nde yüzde oranındaki işletme bu yaz tesislerini açmadı açanlar da yüzde dolulukla çalışıyor ;,0
egeden samosadasinin tam yanindan bir gunduz ve gece yasiyoruz nerdeyse tum antik felsefecilerin neden bu cografyadan ciktiklarini artik cook iyi anliyoruz ;,1
istanbul dan kalkış yaparak vıp araçlarımızla bodrum antalya sapanca ve bir çok bölgeye araçlarımızla sizleri güven içerisinde transferinizi yapıyoruz  ;,0
marieta adaları ilgi çekmekle sınırlı kalmıyor ;,1
 tui seyahat acentesi şubesini kapatmayı planlıyor;,0
 ilerleyen günlerde ele alınabilecekler konulardan bir tanesi de turizm pandemi sonrası ekolojik turizm ;,0
konforlu bir konaklama deneyimi için tüm detaylar düşünüldü ;,0
 web sayfamız yayında sındırgı ya dair her şey bu sayfada nereleri gezerim ne yerim ne götürürüm turizmle ilgili ne varsa doğalşehir sındırgı ;,0
uefa nın istanbul kararı turizmcileri sevindirdi otellerin şampiyonlar ligi finali katılımcılarından aldığı avansların iadesi sorunu da çözüldü  ;,0
türkiye sağlık turizminde geçen yıl milyon turist ağırladı turistlerin bıraktığı döviz ise milyar dolara ulaştı türkiye turist başına geliri kat artırdığı için sektörde ataklarını sürdürüyor  ;,0
selçuklu sultanı i izzeddin keykavus tarafından da yaptırılan evdirhan da taş sanatının en güzel örnekleri mevcut  ;,1
her yıl milyonlarca turiste ev sahipliği yapan antalya ocak eylül döneminde ülkeden milyon bin turisti ağırlarken kente en fazla yabancı turist rusya dan geldi  ;,0
geçtiğimiz ay ne atanan sn valimiz yı olarak makamında ziyaret ettik turizm ve antalya yı konuştuk ;,0
iğdır da doğa harikası üçkaya gölü her mevsim ayrı güzel iğdır da bulunan doğa harikası üçkaya gölü her mevsim sunduğu güzellikleriyle ziyaretçilerini büyülüyor  ;,1
çanakkale de görülecek yerler ;,1
turizm yıllarca ekonomiyi sırtladı turizm çalışanları olarak yıllarca iyi zamanda desteğimizi verdiğimiz devletimiz bizi boynu bükük koydu yarım yamalak borca mahsuben bir kredi verecekti ondanda haber yok coğrafya kaderindir iş aş ekmek beceriksizlik ;,0
 bahattin yücel turizmde hasar tespit raporu çıkarılmalı ;,0
 dünyaca ünlü turizm merkezi uzungöl de kovid sessizliği ;,1
covid dolayısı ile ziyaretçilere belirli saatlerde izin verilen nemrut dağı ziyaret saatleri değişti gün doğumunu ve gün batımını nemrut da izleyebileceğiz  ;,1
kapadokya da ki aziz jean kilisesi çok şey anlatıyor  ;,1
coronavirüs tedbirlerine uymayan beach club gün kapatıldı  ;,1
altı yıldan beri her yıl trip advisor traveller s choice ödülü alıyoruz bu yılın ödülü de ulaştı teşekkürler herkese  ;,1
yunanistan dış turizme açılıyor   ;,0
tura ödediğimiz tutarların iadesini bekliyoruz ;,0
giresun teknoloji ile turizmde çağ atlayacak ;,0
 türkiye yaz turizm bölgeleri konut değer endeksi raporu açıklandı ;,0
 ramazan şimşek tulumtaş mağarası nın turizm faaliyetlerine sağlayacağı katkılar ile ilgili bilgi verdi  ;,1
 ersoy pandemi sürecinden normalleşme sürecine girdiğimiz bu günlerde turizm sektörüne dair son durum değerlendirmesi yaptı  ;,0
türkiye deki rus turist sayısında şok oran ;,0
iç turizm harcamalarında taksit adımı   ;,0
 ve acentelerinin yeni destinasyonu ;,0
ötv  arttığı gün yazmıştım alman devleti vergileri sert bir şekilde artırdı alman otomobil üreticileri ağır darbe  ;,0
akçaabat ın en önemli turizm değerlerinden olan tarihi orta mahalle evlerimizin silüetini bozan ve görüntü kirliliğine sebep olan ucube duvar kaldırılmalı çevre düzenleme çalışmaları tarihi dokuya uygun olarak yapılmalıdır  ;,1
 yunan adaları post corona dönemine hazırlanıyor ;,1
 arabası var liralık yardımın peşinden koşturuyor ;,0
ankara da mutlaka görülmesi gereken tarihi mekanlar;,1
bugün antalya ya rusya dan uçak ile bin turist geliyor;,0
antalya uçuşlarında yüzde lik kapasite artışına gitti   ;,0
boeing işgücünü azaltıyor ;,0
kardüz yaylasında kamp yapın manzara ve karın keyfini çıkarın  ;,1
fahiş fiyatlar ingiliz turisti endişelendirdi ;,0
ardahan ın posof ilçesinde peribacaları görünümlü oluşumlar ile dikkati çeken halk arasında hıram olarak adlandırılan vadi turizme kazandırılıyor ;,1
 turizm emekçileri kaderine terkedildi  ;,0
nisan ayında başlaması beklenen sezon agustos ayında başlıyor antalya uçuşları ağustosta basliyor sezonun geri kalanında ne kadar turist ziyaret eder tahmin etmek çok zor turizm de sıkıntılı bir süreç var ;,0
diyarbakır ın kapadokyası keşfedilmeyi bekliyor ;,1
pek çoğu görsel algıdan uzak araştırmadan estetikten ve zamanın ruhundan uzak teknelerini yürütmeye çalışıyor yazık çok yazık acınacak haldeler ;,1
